{
  "source_event_id": "FD001-engine001-cycle030",
  "stream_id": "replay-demo-001",
  "machine_id": "11111111-1111-4111-8111-111111111111",
  "event_time": "2026-10-22T08:00:00Z",
  "data_mode": "replay",
  "cycle": 30,
  "settings": [
    0.0,
    0.0,
    100.0
  ],
  "readings": [
    {
      "sensor_id": "22222222-2222-4222-8222-222222222222",
      "value": 0.62,
      "unit": "dataset_native"
    }
  ]
}
